{
    "id": "review-035-casa-termas-federacion-guest",
    "userId": "guest-user-12345",
    "accommodationId": "casa-termas-federacion",
    "title": "Perfecto para descansar",
    "content": "Exactamente lo que necesitaba. Un lugar tranquilo, limpio y cómodo. La atención personalizada hace la diferencia. Las instalaciones están bien mantenidas y el ambiente es muy relajante.",
    "rating": {
        "cleanliness": 5,
        "hospitality": 4,
        "services": 4,
        "accuracy": 5,
        "communication": 4,
        "location": 4
    }
}